[
  {
    "type": "Screen",
    "id": "account-settings-settings",
    "title": "Account settings",
    "flow": "account-settings",
    "step": "settings",
    "children": [
      {
        "type": "Form",
        "id": "settings-form",
        "columns": 1,
        "children": [
          {
            "type": "Field",
            "name": "name",
            "label": "Full name",
            "inputType": "text",
            "required": false,
            "autocomplete": "name"
          },
          {
            "type": "Field",
            "name": "email",
            "label": "Email address",
            "inputType": "email",
            "required": true,
            "autocomplete": "email"
          },
          {
            "type": "Field",
            "name": "newsletter",
            "label": "Send me the monthly product newsletter",
            "inputType": "checkbox",
            "required": false
          },
          {
            "type": "Button",
            "label": "Save changes",
            "variant": "primary",
            "action": {
              "kind": "submit",
              "target": "settings-form"
            }
          }
        ]
      },
      {
        "type": "Card",
        "role": "danger-zone",
        "title": "Danger zone",
        "children": [
          {
            "type": "Text",
            "value": "Deleting your account is permanent and removes all of your data.",
            "role": "body"
          },
          {
            "type": "Button",
            "label": "Delete account",
            "variant": "danger",
            "action": {
              "kind": "open-dialog",
              "target": "confirm-delete"
            }
          }
        ]
      }
    ],
    "dialogs": [
      {
        "type": "Dialog",
        "id": "confirm-delete",
        "title": "Delete your account?",
        "destructive": true,
        "confirmVariant": "danger",
        "confirmLabel": "Delete my account",
        "cancelLabel": "Keep my account",
        "children": [
          {
            "type": "Text",
            "value": "This permanently deletes your account and all associated data. This cannot be undone.",
            "role": "body"
          }
        ]
      }
    ]
  }
]